{
  "id": "urn:duly:receipt:sha256:e17006eb51ae180850d881a5c23af4183227cb4bea5a38ec2861219e8c1a3076",
  "receiptSha256": "e17006eb51ae180850d881a5c23af4183227cb4bea5a38ec2861219e8c1a3076",
  "caseId": "case:golden:resc-0009",
  "decision": {
    "entity": "loan:resc-0009",
    "attribute": "resc:rescissionDeadline",
    "value": {
      "kind": "date",
      "value": "2026-03-02"
    }
  },
  "asOf": {
    "effective": "2026-03-03T00:00:00Z",
    "knowledge": "2026-03-05T12:00:00Z"
  },
  "rulePack": {
    "name": "tila-rescission-us-federal",
    "version": "2026.1.0"
  },
  "rulesFired": [
    {
      "ruleId": "RESC-APP-01",
      "version": "1.0.0",
      "citation": {
        "text": "12 CFR § 1026.23(a)(1)",
        "url": "https://www.ecfr.gov/current/title-12/chapter-X/part-1026/subpart-C/section-1026.23#p-1026.23(a)(1)"
      },
      "priority": 100,
      "effectiveFrom": "2011-12-30T00:00:00Z",
      "defeated": []
    },
    {
      "ruleId": "RESC-DL-01",
      "version": "1.0.0",
      "citation": {
        "text": "12 CFR § 1026.23(a)(3)(i); 12 CFR § 1026.2(a)(6) (precise business-day definition)",
        "url": "https://www.ecfr.gov/current/title-12/chapter-X/part-1026/subpart-C/section-1026.23#p-1026.23(a)(3)(i)"
      },
      "priority": 100,
      "effectiveFrom": "2011-12-30T00:00:00Z",
      "defeated": []
    },
    {
      "ruleId": "RESC-FUND-EXP",
      "version": "1.0.0",
      "citation": {
        "text": "12 CFR § 1026.23(c); 12 CFR § 1026.23(a)(3)(i)",
        "url": "https://www.ecfr.gov/current/title-12/chapter-X/part-1026/subpart-C/section-1026.23#p-1026.23(c)"
      },
      "priority": 100,
      "effectiveFrom": "2011-12-30T00:00:00Z",
      "defeated": [
        "RESC-FUND-DEF"
      ]
    }
  ],
  "derivation": {
    "conclusion": {
      "entity": "loan:resc-0009",
      "attribute": "resc:rescissionDeadline",
      "value": {
        "kind": "date",
        "value": "2026-03-02"
      }
    },
    "rule": "RESC-DL-01",
    "premises": [
      {
        "factId": "urn:duly:fact:sha256:05ce47bc0fd97c2140d7dc4c226a82928eae827c9ad580079e0adfe90193c097"
      },
      {
        "factId": "urn:duly:fact:sha256:09e24a4999aea1e51823329cf794edc76f12980e6a19c49ec783251e72b18403"
      },
      {
        "factId": "urn:duly:fact:sha256:9d8a39f0462cb818bb94ab874c75a6b672c534c612b345a0b039cde1cfb643d5"
      },
      {
        "factId": "urn:duly:fact:sha256:dd5fce476a98976a3e58dd38a63cae38a16aa5394e0cb848baa6e87a49309a6c"
      },
      {
        "conclusion": {
          "entity": "loan:resc-0009",
          "attribute": "resc:rescissionApplies",
          "value": {
            "kind": "boolean",
            "value": true
          }
        },
        "rule": "RESC-APP-01",
        "premises": [
          {
            "factId": "urn:duly:fact:sha256:ee4d0e5d60c710a072e5fcc64237dc435c4d05eaffc27c7588e999ca330b1bc5"
          }
        ]
      }
    ]
  },
  "inputFacts": [
    {
      "id": "urn:duly:fact:sha256:05ce47bc0fd97c2140d7dc4c226a82928eae827c9ad580079e0adfe90193c097",
      "contentHash": "05ce47bc0fd97c2140d7dc4c226a82928eae827c9ad580079e0adfe90193c097"
    },
    {
      "id": "urn:duly:fact:sha256:09e24a4999aea1e51823329cf794edc76f12980e6a19c49ec783251e72b18403",
      "contentHash": "09e24a4999aea1e51823329cf794edc76f12980e6a19c49ec783251e72b18403"
    },
    {
      "id": "urn:duly:fact:sha256:9d8a39f0462cb818bb94ab874c75a6b672c534c612b345a0b039cde1cfb643d5",
      "contentHash": "9d8a39f0462cb818bb94ab874c75a6b672c534c612b345a0b039cde1cfb643d5"
    },
    {
      "id": "urn:duly:fact:sha256:dd5fce476a98976a3e58dd38a63cae38a16aa5394e0cb848baa6e87a49309a6c",
      "contentHash": "dd5fce476a98976a3e58dd38a63cae38a16aa5394e0cb848baa6e87a49309a6c"
    },
    {
      "id": "urn:duly:fact:sha256:ee4d0e5d60c710a072e5fcc64237dc435c4d05eaffc27c7588e999ca330b1bc5",
      "contentHash": "ee4d0e5d60c710a072e5fcc64237dc435c4d05eaffc27c7588e999ca330b1bc5"
    }
  ],
  "abstentions": [],
  "engine": {
    "kernel": "duly-kernel",
    "version": "0.0.1",
    "backend": "reference"
  }
}
