{
  "id": "urn:duly:receipt:sha256:681318c81037d693a49c5575778f52a2315bbf6d418b61ec27a87151c5cfe290",
  "receiptSha256": "681318c81037d693a49c5575778f52a2315bbf6d418b61ec27a87151c5cfe290",
  "caseId": "case:golden:notice-ca-0007",
  "decision": {
    "entity": "notice:notice-ca-0007",
    "attribute": "nc:noticeCompliant",
    "value": {
      "kind": "boolean",
      "value": true
    }
  },
  "asOf": {
    "effective": "2026-08-23T00:00:00Z",
    "knowledge": "2026-08-25T12:00:00Z"
  },
  "rulePack": {
    "name": "termination-notice-us-states",
    "version": "2026.2.0"
  },
  "rulesFired": [
    {
      "ruleId": "NC-DEF-00",
      "version": "1.0.0",
      "citation": {
        "text": "Default presumption"
      },
      "priority": 0,
      "effectiveFrom": "1900-01-01T00:00:00Z",
      "defeated": []
    },
    {
      "ruleId": "CA-NR-75",
      "version": "1.0.0",
      "citation": {
        "text": "Cal. Ins. Code § 678(c)",
        "url": "https://leginfo.legislature.ca.gov/faces/codes_displaySection.xhtml?lawCode=INS&sectionNum=678."
      },
      "priority": 100,
      "effectiveFrom": "2020-07-01T00:00:00Z",
      "defeated": []
    }
  ],
  "derivation": {
    "conclusion": {
      "entity": "notice:notice-ca-0007",
      "attribute": "nc:noticeCompliant",
      "value": {
        "kind": "boolean",
        "value": true
      }
    },
    "rule": "NC-DEF-00",
    "premises": []
  },
  "inputFacts": [],
  "abstentions": [],
  "engine": {
    "kernel": "duly-kernel",
    "version": "0.0.1",
    "backend": "reference"
  }
}
