{
  "id": "urn:duly:receipt:sha256:e7d1cfc2c16617556c6f1c33cd04a1e0b4f497808ebe7e3370be593a6f9d2420",
  "receiptSha256": "e7d1cfc2c16617556c6f1c33cd04a1e0b4f497808ebe7e3370be593a6f9d2420",
  "caseId": "case:golden:ron-0013",
  "decision": {
    "entity": "notarization:ron-0013",
    "attribute": "ron:notarizationCompliant",
    "value": {
      "kind": "boolean",
      "value": false
    }
  },
  "asOf": {
    "effective": "2028-12-31T00:00:00Z",
    "knowledge": "2029-01-02T12:00:00Z"
  },
  "rulePack": {
    "name": "notarization-ron-us-states",
    "version": "2026.1.0"
  },
  "rulesFired": [
    {
      "ruleId": "RON-DEF-00",
      "version": "1.0.0",
      "citation": {
        "text": "Default presumption (fail closed: RON exists only by statutory authorization)"
      },
      "priority": 0,
      "effectiveFrom": "1900-01-01T00:00:00Z",
      "defeated": []
    },
    {
      "ruleId": "RON-COMP-01",
      "version": "1.0.0",
      "citation": {
        "text": "Derived: the state authorization rules of this pack, applied to the method used"
      },
      "priority": 200,
      "effectiveFrom": "1900-01-01T00:00:00Z",
      "defeated": [
        "RON-COMP-00"
      ]
    }
  ],
  "derivation": {
    "conclusion": {
      "entity": "notarization:ron-0013",
      "attribute": "ron:notarizationCompliant",
      "value": {
        "kind": "boolean",
        "value": false
      }
    },
    "rule": "RON-COMP-01",
    "premises": [
      {
        "factId": "urn:duly:fact:sha256:deb0e2290129145098e96963658d8348403df64d8d9e5c8fb9e17635d2d85e7c"
      },
      {
        "conclusion": {
          "entity": "notarization:ron-0013",
          "attribute": "ron:ronPermitted",
          "value": {
            "kind": "boolean",
            "value": false
          }
        },
        "rule": "RON-DEF-00",
        "premises": []
      }
    ]
  },
  "inputFacts": [
    {
      "id": "urn:duly:fact:sha256:deb0e2290129145098e96963658d8348403df64d8d9e5c8fb9e17635d2d85e7c",
      "contentHash": "deb0e2290129145098e96963658d8348403df64d8d9e5c8fb9e17635d2d85e7c"
    }
  ],
  "abstentions": [],
  "engine": {
    "kernel": "duly-kernel",
    "version": "0.0.1",
    "backend": "reference"
  }
}
