{
  "id": "urn:duly:receipt:sha256:6374f255a377671cc2acd7ee365871af2a76855f717df65772aab16d071a3fbd",
  "receiptSha256": "6374f255a377671cc2acd7ee365871af2a76855f717df65772aab16d071a3fbd",
  "caseId": "case:golden:rec-0025",
  "decision": {
    "entity": "submission:rec-0025",
    "attribute": "rec:recordable",
    "value": {
      "kind": "boolean",
      "value": true
    }
  },
  "asOf": {
    "effective": "1989-11-27T00:00:00Z",
    "knowledge": "1989-11-29T12:00:00Z"
  },
  "rulePack": {
    "name": "county-recording-us",
    "version": "2026.1.0"
  },
  "rulesFired": [
    {
      "ruleId": "REC-DEF-AZ",
      "version": "1.0.0",
      "citation": {
        "text": "Default presumption (Arizona packages only)"
      },
      "priority": 0,
      "effectiveFrom": "1900-01-01T00:00:00Z",
      "defeated": []
    }
  ],
  "derivation": {
    "conclusion": {
      "entity": "submission:rec-0025",
      "attribute": "rec:recordable",
      "value": {
        "kind": "boolean",
        "value": true
      }
    },
    "rule": "REC-DEF-AZ",
    "premises": [
      {
        "factId": "urn:duly:fact:sha256:4754e99a676aceb62c5e5c05e179dcdceb1dc3c28f0c21ce1c18c9dec35071ff"
      }
    ]
  },
  "inputFacts": [
    {
      "id": "urn:duly:fact:sha256:4754e99a676aceb62c5e5c05e179dcdceb1dc3c28f0c21ce1c18c9dec35071ff",
      "contentHash": "4754e99a676aceb62c5e5c05e179dcdceb1dc3c28f0c21ce1c18c9dec35071ff"
    }
  ],
  "abstentions": [],
  "engine": {
    "kernel": "duly-kernel",
    "version": "0.0.1",
    "backend": "reference"
  }
}
