{
  "id": "urn:duly:receipt:sha256:6d078e84bba8c3e4b8bb3129849a38f0bb60aa5b0a97d6b8c1c55fbb5f054da2",
  "receiptSha256": "6d078e84bba8c3e4b8bb3129849a38f0bb60aa5b0a97d6b8c1c55fbb5f054da2",
  "caseId": "case:golden:notice-fl-0003",
  "decision": {
    "entity": "notice:notice-fl-0003",
    "attribute": "nc:noticeCompliant",
    "value": {
      "kind": "boolean",
      "value": false
    }
  },
  "asOf": {
    "effective": "2025-12-19T00:00:00Z",
    "knowledge": "2025-12-21T12:00:00Z"
  },
  "rulePack": {
    "name": "termination-notice-us-states",
    "version": "2026.2.0"
  },
  "rulesFired": [
    {
      "ruleId": "FL-NR-120",
      "version": "1.0.0",
      "citation": {
        "text": "Fla. Stat. § 627.4133(2)(b)",
        "url": "http://www.leg.state.fl.us/statutes/index.cfm?App_mode=Display_Statute&URL=0600-0699/0627/Sections/0627.4133.html"
      },
      "priority": 100,
      "effectiveFrom": "2016-01-01T00:00:00Z",
      "defeated": []
    },
    {
      "ruleId": "NC-NR-01",
      "version": "1.0.2",
      "citation": {
        "text": "N.Y. Ins. Law § 3425(d)(1)",
        "url": "https://www.nysenate.gov/legislation/laws/ISC/3425"
      },
      "priority": 200,
      "effectiveFrom": "1986-01-01T00:00:00Z",
      "defeated": [
        "NC-DEF-00"
      ]
    }
  ],
  "derivation": {
    "conclusion": {
      "entity": "notice:notice-fl-0003",
      "attribute": "nc:noticeCompliant",
      "value": {
        "kind": "boolean",
        "value": false
      }
    },
    "rule": "NC-NR-01",
    "premises": [
      {
        "factId": "urn:duly:fact:sha256:5d543da547b2abd722d8a07e14bad6e607bed508e26319017c4272cbd0987132"
      },
      {
        "factId": "urn:duly:fact:sha256:f85ab097fe4a3781fd740506f4bf1cc39d9c670dc736a2d860a3e678cf30ae7c"
      },
      {
        "conclusion": {
          "entity": "notice:notice-fl-0003",
          "attribute": "nc:requiredMinimumNoticeDays",
          "value": {
            "kind": "decimal",
            "value": "120"
          }
        },
        "rule": "FL-NR-120",
        "premises": [
          {
            "factId": "urn:duly:fact:sha256:15123bfe5ca9fd742e4320d4a32b5748de1fee9c8b05bbcaba3878f10b0c913a"
          },
          {
            "factId": "urn:duly:fact:sha256:7dd53a27d9d961e0122a25d54bf71535130ebc3c67dbf778a4dc2b27aba1d6ff"
          }
        ]
      }
    ]
  },
  "inputFacts": [
    {
      "id": "urn:duly:fact:sha256:5d543da547b2abd722d8a07e14bad6e607bed508e26319017c4272cbd0987132",
      "contentHash": "5d543da547b2abd722d8a07e14bad6e607bed508e26319017c4272cbd0987132"
    },
    {
      "id": "urn:duly:fact:sha256:f85ab097fe4a3781fd740506f4bf1cc39d9c670dc736a2d860a3e678cf30ae7c",
      "contentHash": "f85ab097fe4a3781fd740506f4bf1cc39d9c670dc736a2d860a3e678cf30ae7c"
    },
    {
      "id": "urn:duly:fact:sha256:15123bfe5ca9fd742e4320d4a32b5748de1fee9c8b05bbcaba3878f10b0c913a",
      "contentHash": "15123bfe5ca9fd742e4320d4a32b5748de1fee9c8b05bbcaba3878f10b0c913a"
    },
    {
      "id": "urn:duly:fact:sha256:7dd53a27d9d961e0122a25d54bf71535130ebc3c67dbf778a4dc2b27aba1d6ff",
      "contentHash": "7dd53a27d9d961e0122a25d54bf71535130ebc3c67dbf778a4dc2b27aba1d6ff"
    }
  ],
  "abstentions": [],
  "engine": {
    "kernel": "duly-kernel",
    "version": "0.0.1",
    "backend": "reference"
  }
}
