{
  "id": "urn:duly:receipt:sha256:dba22d326781727b965c2d13307c99c100ca6c04f484a0e6c08ce0f72656fd59",
  "receiptSha256": "dba22d326781727b965c2d13307c99c100ca6c04f484a0e6c08ce0f72656fd59",
  "caseId": "case:golden:ron-0019",
  "decision": {
    "entity": "notarization:ron-0019",
    "attribute": "ron:notarizationCompliant",
    "value": {
      "kind": "boolean",
      "value": true
    }
  },
  "asOf": {
    "effective": "2022-01-02T00:00:00Z",
    "knowledge": "2022-01-04T12:00:00Z"
  },
  "rulePack": {
    "name": "notarization-ron-us-states",
    "version": "2026.1.0"
  },
  "rulesFired": [
    {
      "ruleId": "RON-DEF-00",
      "version": "1.0.0",
      "citation": {
        "text": "Default presumption (fail closed: RON exists only by statutory authorization)"
      },
      "priority": 0,
      "effectiveFrom": "1900-01-01T00:00:00Z",
      "defeated": []
    },
    {
      "ruleId": "RON-COMP-00",
      "version": "1.0.0",
      "citation": {
        "text": "Default presumption"
      },
      "priority": 0,
      "effectiveFrom": "1900-01-01T00:00:00Z",
      "defeated": []
    }
  ],
  "derivation": {
    "conclusion": {
      "entity": "notarization:ron-0019",
      "attribute": "ron:notarizationCompliant",
      "value": {
        "kind": "boolean",
        "value": true
      }
    },
    "rule": "RON-COMP-00",
    "premises": []
  },
  "inputFacts": [],
  "abstentions": [],
  "engine": {
    "kernel": "duly-kernel",
    "version": "0.0.1",
    "backend": "reference"
  }
}
