{
  "id": "urn:duly:receipt:sha256:accb79596ed6abd9204ba3e7a729234d4513a185dc3406f7c739d435ddeb099b",
  "receiptSha256": "accb79596ed6abd9204ba3e7a729234d4513a185dc3406f7c739d435ddeb099b",
  "caseId": "case:golden:esign-0001",
  "decision": {
    "entity": "task:esign-0001",
    "attribute": "pkg:signingMethod",
    "value": {
      "kind": "code",
      "value": "WetInk",
      "codeSystem": "duly-starter-esign/signing-methods",
      "codeSystemVersion": "0.1.0"
    }
  },
  "asOf": {
    "effective": "2015-03-17T00:00:00Z",
    "knowledge": "2015-03-19T12:00:00Z"
  },
  "rulePack": {
    "name": "esign-closing-package",
    "version": "2026.1.0"
  },
  "rulesFired": [
    {
      "ruleId": "PKG-DEF-00",
      "version": "1.0.0",
      "citation": {
        "text": "Default presumption (fail-safe to wet ink)"
      },
      "priority": 0,
      "effectiveFrom": "1900-01-01T00:00:00Z",
      "defeated": []
    },
    {
      "ruleId": "PKG-DEF-01",
      "version": "1.0.0",
      "citation": {
        "text": "Default presumption (fail-safe to wet ink)"
      },
      "priority": 0,
      "effectiveFrom": "1900-01-01T00:00:00Z",
      "defeated": []
    }
  ],
  "derivation": {
    "conclusion": {
      "entity": "task:esign-0001",
      "attribute": "pkg:signingMethod",
      "value": {
        "kind": "code",
        "value": "WetInk",
        "codeSystem": "duly-starter-esign/signing-methods",
        "codeSystemVersion": "0.1.0"
      }
    },
    "rule": "PKG-DEF-00",
    "premises": []
  },
  "inputFacts": [],
  "abstentions": [],
  "engine": {
    "kernel": "duly-kernel",
    "version": "0.0.1",
    "backend": "reference"
  }
}
