{
  "id": "urn:duly:receipt:sha256:fad1bf1b3ec5317b227cf5f701236d3f91d7751fc12f1084c927bef647f4d629",
  "receiptSha256": "fad1bf1b3ec5317b227cf5f701236d3f91d7751fc12f1084c927bef647f4d629",
  "caseId": "case:golden:notice-ny-0007",
  "decision": {
    "entity": "notice:notice-ny-0007",
    "attribute": "nc:noticeCompliant",
    "value": {
      "kind": "boolean",
      "value": true
    }
  },
  "asOf": {
    "effective": "2026-01-13T00:00:00Z",
    "knowledge": "2026-01-15T12:00:00Z"
  },
  "rulePack": {
    "name": "termination-notice-us-states",
    "version": "2026.2.0"
  },
  "rulesFired": [
    {
      "ruleId": "NC-DEF-00",
      "version": "1.0.0",
      "citation": {
        "text": "Default presumption"
      },
      "priority": 0,
      "effectiveFrom": "1900-01-01T00:00:00Z",
      "defeated": []
    },
    {
      "ruleId": "NY-NR-NONPAY-15",
      "version": "1.1.0",
      "citation": {
        "text": "N.Y. Ins. Law § 3425(c)(1)(A)",
        "url": "https://www.nysenate.gov/legislation/laws/ISC/3425"
      },
      "priority": 150,
      "effectiveFrom": "1986-01-01T00:00:00Z",
      "defeated": [
        "NY-NR-45"
      ]
    }
  ],
  "derivation": {
    "conclusion": {
      "entity": "notice:notice-ny-0007",
      "attribute": "nc:noticeCompliant",
      "value": {
        "kind": "boolean",
        "value": true
      }
    },
    "rule": "NC-DEF-00",
    "premises": []
  },
  "inputFacts": [],
  "abstentions": [],
  "engine": {
    "kernel": "duly-kernel",
    "version": "0.0.1",
    "backend": "reference"
  }
}
