{
  "id": "urn:duly:receipt:sha256:9034c46cefa8d78d6a50360e59a276fb88c34c20b5384eeaa1bae45fb3b21095",
  "receiptSha256": "9034c46cefa8d78d6a50360e59a276fb88c34c20b5384eeaa1bae45fb3b21095",
  "caseId": "case:golden:notice-ny-0051",
  "decision": {
    "entity": "notice:notice-ny-0051",
    "attribute": "nc:noticeCompliant",
    "value": {
      "kind": "boolean",
      "value": true
    }
  },
  "asOf": {
    "effective": "2026-06-10T00:00:00Z",
    "knowledge": "2026-06-12T12:00:00Z"
  },
  "rulePack": {
    "name": "termination-notice-us-states",
    "version": "2026.3.0"
  },
  "rulesFired": [
    {
      "ruleId": "NC-DEF-00",
      "version": "1.0.0",
      "citation": {
        "text": "Default presumption"
      },
      "priority": 0,
      "effectiveFrom": "1900-01-01T00:00:00Z",
      "defeated": []
    },
    {
      "ruleId": "NY-NR-45",
      "version": "1.1.0",
      "citation": {
        "text": "N.Y. Ins. Law § 3425(d)(1)",
        "url": "https://www.nysenate.gov/legislation/laws/ISC/3425"
      },
      "priority": 100,
      "effectiveFrom": "2026-01-01T00:00:00Z",
      "defeated": []
    }
  ],
  "derivation": {
    "conclusion": {
      "entity": "notice:notice-ny-0051",
      "attribute": "nc:noticeCompliant",
      "value": {
        "kind": "boolean",
        "value": true
      }
    },
    "rule": "NC-DEF-00",
    "premises": []
  },
  "inputFacts": [],
  "abstentions": [],
  "engine": {
    "kernel": "duly-kernel",
    "version": "0.0.1",
    "backend": "reference"
  }
}
