{
  "id": "urn:duly:receipt:sha256:2589cef908fe2fd33477e782925557a01c1f0dc90047f51a39047dc94c1da15f",
  "receiptSha256": "2589cef908fe2fd33477e782925557a01c1f0dc90047f51a39047dc94c1da15f",
  "caseId": "case:golden:notice-fl-0009",
  "decision": {
    "entity": "notice:notice-fl-0009",
    "attribute": "nc:noticeCompliant",
    "value": {
      "kind": "boolean",
      "value": true
    }
  },
  "asOf": {
    "effective": "2026-04-10T00:00:00Z",
    "knowledge": "2026-04-12T12:00:00Z"
  },
  "rulePack": {
    "name": "termination-notice-us-states",
    "version": "2026.3.0"
  },
  "rulesFired": [
    {
      "ruleId": "NC-DEF-00",
      "version": "1.0.0",
      "citation": {
        "text": "Default presumption"
      },
      "priority": 0,
      "effectiveFrom": "1900-01-01T00:00:00Z",
      "defeated": []
    },
    {
      "ruleId": "FL-NR-120",
      "version": "1.0.0",
      "citation": {
        "text": "Fla. Stat. § 627.4133(2)(b)",
        "url": "http://www.leg.state.fl.us/statutes/index.cfm?App_mode=Display_Statute&URL=0600-0699/0627/Sections/0627.4133.html"
      },
      "priority": 100,
      "effectiveFrom": "2016-01-01T00:00:00Z",
      "defeated": []
    }
  ],
  "derivation": {
    "conclusion": {
      "entity": "notice:notice-fl-0009",
      "attribute": "nc:noticeCompliant",
      "value": {
        "kind": "boolean",
        "value": true
      }
    },
    "rule": "NC-DEF-00",
    "premises": []
  },
  "inputFacts": [],
  "abstentions": [
    {
      "entity": "notice:notice-fl-0009",
      "attribute": "nc:noticeMailedDate",
      "reason": "low_confidence",
      "facts": [
        "urn:duly:fact:sha256:050e61aca21927e54dcb74cb4d8a453c8c026b8a6ccc7788cbbca9d351e40a2c"
      ],
      "confidence": {
        "score": 0.6,
        "method": "platt"
      },
      "threshold": {
        "minConfidence": 0.9,
        "source": "attribute",
        "pack": "termination-notice-us-states",
        "packVersion": "2026.3.0"
      }
    }
  ],
  "engine": {
    "kernel": "duly-kernel",
    "version": "0.0.1",
    "backend": "reference"
  }
}
