{
  "id": "urn:duly:receipt:sha256:86dc1e9249b3247deacdc0a42a9a21639dc389e76f4ca8c18d0c5d2da96bee51",
  "receiptSha256": "86dc1e9249b3247deacdc0a42a9a21639dc389e76f4ca8c18d0c5d2da96bee51",
  "caseId": "case:golden:notice-ny-0069",
  "decision": {
    "entity": "notice:notice-ny-0069",
    "attribute": "nc:noticeCompliant",
    "value": {
      "kind": "boolean",
      "value": true
    }
  },
  "asOf": {
    "effective": "2026-09-22T00:00:00Z",
    "knowledge": "2026-09-24T12:00:00Z"
  },
  "rulePack": {
    "name": "termination-notice-us-states",
    "version": "2026.3.0"
  },
  "rulesFired": [
    {
      "ruleId": "NC-DEF-00",
      "version": "1.0.0",
      "citation": {
        "text": "Default presumption"
      },
      "priority": 0,
      "effectiveFrom": "1900-01-01T00:00:00Z",
      "defeated": []
    },
    {
      "ruleId": "NY-NR-45",
      "version": "1.1.0",
      "citation": {
        "text": "N.Y. Ins. Law § 3425(d)(1)",
        "url": "https://www.nysenate.gov/legislation/laws/ISC/3425"
      },
      "priority": 100,
      "effectiveFrom": "2026-01-01T00:00:00Z",
      "defeated": []
    }
  ],
  "derivation": {
    "conclusion": {
      "entity": "notice:notice-ny-0069",
      "attribute": "nc:noticeCompliant",
      "value": {
        "kind": "boolean",
        "value": true
      }
    },
    "rule": "NC-DEF-00",
    "premises": []
  },
  "inputFacts": [],
  "abstentions": [
    {
      "entity": "notice:notice-ny-0069",
      "attribute": "nc:noticeMailedDate",
      "reason": "low_confidence",
      "facts": [
        "urn:duly:fact:sha256:700b3bcde39646e72aec6b0790e9b7d853ba1facfa2e3874b78c133a232207a0"
      ],
      "confidence": {
        "score": 0.6,
        "method": "platt"
      },
      "threshold": {
        "minConfidence": 0.9,
        "source": "attribute",
        "pack": "termination-notice-us-states",
        "packVersion": "2026.3.0"
      }
    },
    {
      "entity": "policy:notice-ny-0069",
      "attribute": "nc:policyExpirationDate",
      "reason": "low_confidence",
      "facts": [
        "urn:duly:fact:sha256:9601ce36f8c05276d52be9718ee3450bb84383ab29aa5b91e95b2e147521cc76"
      ],
      "confidence": {
        "score": 0.7,
        "method": "temperature"
      },
      "threshold": {
        "minConfidence": 0.75,
        "source": "default",
        "pack": "termination-notice-us-states",
        "packVersion": "2026.3.0"
      }
    }
  ],
  "engine": {
    "kernel": "duly-kernel",
    "version": "0.0.1",
    "backend": "reference"
  }
}
