{
  "id": "urn:duly:receipt:sha256:78f7d0b275a99dc1671487274e61e32473de6a07d519047b8b71573335ca22b4",
  "receiptSha256": "78f7d0b275a99dc1671487274e61e32473de6a07d519047b8b71573335ca22b4",
  "caseId": "case:golden:notice-fl-0020",
  "decision": {
    "entity": "notice:notice-fl-0020",
    "attribute": "nc:noticeCompliant",
    "value": {
      "kind": "boolean",
      "value": false
    }
  },
  "asOf": {
    "effective": "2026-06-04T00:00:00Z",
    "knowledge": "2026-06-06T12:00:00Z"
  },
  "rulePack": {
    "name": "termination-notice-us-states",
    "version": "2026.3.0"
  },
  "rulesFired": [
    {
      "ruleId": "FL-NR-120",
      "version": "1.0.0",
      "citation": {
        "text": "Fla. Stat. § 627.4133(2)(b)",
        "url": "http://www.leg.state.fl.us/statutes/index.cfm?App_mode=Display_Statute&URL=0600-0699/0627/Sections/0627.4133.html"
      },
      "priority": 100,
      "effectiveFrom": "2016-01-01T00:00:00Z",
      "defeated": []
    },
    {
      "ruleId": "NC-NR-01",
      "version": "1.0.2",
      "citation": {
        "text": "N.Y. Ins. Law § 3425(d)(1)",
        "url": "https://www.nysenate.gov/legislation/laws/ISC/3425"
      },
      "priority": 200,
      "effectiveFrom": "1986-01-01T00:00:00Z",
      "defeated": [
        "NC-DEF-00"
      ]
    }
  ],
  "derivation": {
    "conclusion": {
      "entity": "notice:notice-fl-0020",
      "attribute": "nc:noticeCompliant",
      "value": {
        "kind": "boolean",
        "value": false
      }
    },
    "rule": "NC-NR-01",
    "premises": [
      {
        "factId": "urn:duly:fact:sha256:0781686787b91bcdd000d3b44a496e1545e1e3e8715eb8efe49b2c3b5f9b1f88"
      },
      {
        "factId": "urn:duly:fact:sha256:7663611183a647b66bf0be66fc38913a52226a3ffa697c77fc1eceb3842e88af"
      },
      {
        "conclusion": {
          "entity": "notice:notice-fl-0020",
          "attribute": "nc:requiredMinimumNoticeDays",
          "value": {
            "kind": "decimal",
            "value": "120"
          }
        },
        "rule": "FL-NR-120",
        "premises": [
          {
            "factId": "urn:duly:fact:sha256:66e46572a79ddc17f8b39b2721924854c37073680c327f60a9bb72c79dfe356f"
          },
          {
            "factId": "urn:duly:fact:sha256:a0a8a8e2a67bfae276171b55d208d272901aa5aba5a81cf41324a61fce1f59a4"
          }
        ]
      }
    ]
  },
  "inputFacts": [
    {
      "id": "urn:duly:fact:sha256:0781686787b91bcdd000d3b44a496e1545e1e3e8715eb8efe49b2c3b5f9b1f88",
      "contentHash": "0781686787b91bcdd000d3b44a496e1545e1e3e8715eb8efe49b2c3b5f9b1f88"
    },
    {
      "id": "urn:duly:fact:sha256:7663611183a647b66bf0be66fc38913a52226a3ffa697c77fc1eceb3842e88af",
      "contentHash": "7663611183a647b66bf0be66fc38913a52226a3ffa697c77fc1eceb3842e88af"
    },
    {
      "id": "urn:duly:fact:sha256:66e46572a79ddc17f8b39b2721924854c37073680c327f60a9bb72c79dfe356f",
      "contentHash": "66e46572a79ddc17f8b39b2721924854c37073680c327f60a9bb72c79dfe356f"
    },
    {
      "id": "urn:duly:fact:sha256:a0a8a8e2a67bfae276171b55d208d272901aa5aba5a81cf41324a61fce1f59a4",
      "contentHash": "a0a8a8e2a67bfae276171b55d208d272901aa5aba5a81cf41324a61fce1f59a4"
    }
  ],
  "abstentions": [],
  "engine": {
    "kernel": "duly-kernel",
    "version": "0.0.1",
    "backend": "reference"
  }
}
