{
  "id": "urn:duly:receipt:sha256:1ba256e49ef110e57bfdd9b3828ea36407d5e2b5578f24cb807fd6402b84d2ea",
  "receiptSha256": "1ba256e49ef110e57bfdd9b3828ea36407d5e2b5578f24cb807fd6402b84d2ea",
  "caseId": "case:golden:esign-0008",
  "decision": {
    "entity": "task:esign-0008",
    "attribute": "pkg:eSignEligible",
    "value": {
      "kind": "boolean",
      "value": true
    }
  },
  "asOf": {
    "effective": "2028-12-31T00:00:00Z",
    "knowledge": "2029-01-02T12:00:00Z"
  },
  "rulePack": {
    "name": "esign-closing-package",
    "version": "2026.1.0"
  },
  "rulesFired": [
    {
      "ruleId": "PKG-RTC-20",
      "version": "1.0.0",
      "citation": {
        "text": "15 U.S.C. § 7001(c); 12 CFR § 1026.23(b)(1)",
        "url": "https://www.law.cornell.edu/cfr/text/12/1026.23"
      },
      "priority": 100,
      "effectiveFrom": "2011-12-30T00:00:00Z",
      "defeated": [
        "PKG-DEF-01"
      ]
    },
    {
      "ruleId": "PKG-RTC-21",
      "version": "1.0.0",
      "citation": {
        "text": "15 U.S.C. § 7001(c); 12 CFR § 1026.23(b)(1)",
        "url": "https://www.law.cornell.edu/cfr/text/12/1026.23"
      },
      "priority": 100,
      "effectiveFrom": "2011-12-30T00:00:00Z",
      "defeated": [
        "PKG-DEF-00"
      ]
    }
  ],
  "derivation": {
    "conclusion": {
      "entity": "task:esign-0008",
      "attribute": "pkg:eSignEligible",
      "value": {
        "kind": "boolean",
        "value": true
      }
    },
    "rule": "PKG-RTC-20",
    "premises": [
      {
        "factId": "urn:duly:fact:sha256:12986dfa3e14df989aaf7c52b0a9925163f5c07afe1307e46d23f1e95c468075"
      },
      {
        "factId": "urn:duly:fact:sha256:c58d4ce08768ced223f8c54b6ba2b3b9844a6a6c4555d627a2be17916e2dfdf3"
      }
    ]
  },
  "inputFacts": [
    {
      "id": "urn:duly:fact:sha256:12986dfa3e14df989aaf7c52b0a9925163f5c07afe1307e46d23f1e95c468075",
      "contentHash": "12986dfa3e14df989aaf7c52b0a9925163f5c07afe1307e46d23f1e95c468075"
    },
    {
      "id": "urn:duly:fact:sha256:c58d4ce08768ced223f8c54b6ba2b3b9844a6a6c4555d627a2be17916e2dfdf3",
      "contentHash": "c58d4ce08768ced223f8c54b6ba2b3b9844a6a6c4555d627a2be17916e2dfdf3"
    }
  ],
  "abstentions": [],
  "engine": {
    "kernel": "duly-kernel",
    "version": "0.0.1",
    "backend": "reference"
  }
}
